{
  "task_id": "windows-p1-checkout-221f2f8-kimi-r1",
  "contract_version": "harness/1.1",
  "batch": "BL-WINDOWS-P1-CHECKOUT-SUPPORT",
  "role": "evaluator",
  "repo": {
    "url": "/Volumes/ORICO/project/.worktrees/tokenizer-windows-p1-checkout-generator-20261011",
    "ref": "221f2f87d94db1656e3000662796d79621b696f5"
  },
  "spec": "docs/test-reports/BL-WINDOWS-P1-CHECKOUT-plan-20261011/proposal.json",
  "features": ["F004"],
  "l2_authorized": false,
  "deadline_s": 1800,
  "contract": "Fresh independent registered Kimi-family OFFLINE supporting Evaluator, harness section1.5. This is the sole allowed fresh r1 redispatch for NEW C001 checkout-only source221, not Compose HARD_STOP or formal parent F004/F005/native/release acceptance. Do not read or reuse the preceding evaluator's tests, outputs or conclusions. Read harness rules, fixed verdict schema, locked C001 proposal/README, revised bindingsMD/JSON and exact physical code. Verify HEAD221f2f87d94db1656e3000662796d79621b696f5 and parent54af183617ed06c18edd42632326dbfd09451456. Generator/scope reports are claims, not acceptance. Runtime source888a5acd7a8a441c9ec4ad898453f149cf8d6b7c remains the immutable baseline. Exact four candidate hashes: workflow1ab508fc704fe8ceb1aecbdb9b630ea748add97dc5a17a960940ab4e9a83a771; bindingsJSON652a11170499b8c03bcd70d65ba4f8cdd1476a318e119b267d33cbf90ed1922d; MDfc7f4d09915d7200177bf0b4d7c6fc76e95e0423d4e1e2f3f2bc3a1986025ec6; CLI3028d77985e965d3de58c965b526bfe6adf7ddebced8b9173c89a5fb6c56e4f6. Independently verify exact byte projection: workflow ONLY four added lines under checkout env, GIT_CONFIG_COUNT='1', GIT_CONFIG_KEY_0=core.longpaths, GIT_CONFIG_VALUE_0='true' all STRINGS; JSON five exact unique replacements; MD exactappend; CLI ONLY two identity literals then all bytes equal888. Test hash7718f1e6553f1f9bccca0520571727f2a712493ce789bb8a3f0898a75e289132 unchanged. All native E0/guards/API/worker/EOF/cleanup/caps/budgets/selection/14requiredcontrols/11sourceFiles/16uploads/frozen10hashes, original57archive tree and every other tracked tree record are unchanged excluding4candidate+4declaredplan/prescope reports. Run unchanged81 controls and npmrunverify yourself with fresh owned dependencies. Derive OWN compact additive table-driven checks: positive exact workflow/binding identity/provenance; missing/extra/nonstrings/count0/count2/false/secondpair/duplicate; workflow/job/laterstep/GITHUB_ENV leakage; configwrites/sparse/path/newcommands/Secrets/permissions/retries; stale either binding identity/oldsource relabel/oneextraCLIbyte. Clearly distinguish exact-scope controls from original runtime validator behavior; a synthetic exact-byte confinement oracle is acceptable with a real unchanged-workflow positive, no need to implement a broad YAML parser or enumerate unrelated trees. Preserve all acceptance dimensions, do not copy static report checks as run product tests, weaken original validators/assertions, or claim a helper enforces a check it does not. Exercise actual unchanged systemEnvironment with case-insensitive admitted systemkeys plus all3checkoutkeys discarded; fixedEnvironment/guard extra-key closure may use static/pure-function/mock checks. OWN disposable Git fixture runtime-config query allowed with complete isolated explicit childenv, GIT_CONFIG_NOSYSTEM=1, owned empty globalconfig/XDG/HOME. Compare command-scope query to sibling no-added-keys and verify no persistent config changes. No OS/PID/PowerShell probes or liveprocess.kill. This is NOT Windows builtin longpath/native env feasibility. Source imports/test-localVM/mock/pure sealed helpers permitted; new CLI prepare/run/probe/seal/verify-upload and old diagnostic execution forbidden. Use installed Node22.22.0 /Users/yixingzhou/.nvm/versions/node/v22.22.0/bin and /usr/sbin:/sbin. BEFORE imports/tests set own external HOME=USERPROFILE=/Volumes/ORICO/project/.wp1ce-r1-20261011, owned TMPDIR/npmcache beneath it; no realhome/queues/systemtmp/borrowed or symlink deps. Fresh own npmci in your worktree only. Public registry.npmjs.org and only unchanged package-owned locked Prisma binaries.prisma.sh or WiseLibs/better-sqlite3 public release/CDN lifecycle downloads allowed after verifying package references; no manualdownload/globalinstall/auditfix/npm dependency changes/arbitrary egress. Model service permitted. No authenticated GitHubCLI/API/Actions/push/deploy/Secret values/SSH/Docker/DB/installers/keys/credentialstore reads. Report seven-high warnings honestly, optional audit inquiry unnecessary; if lifecyclehosts not observable state that, no full network isolation claim. Only manual edits via Bash apply_patch executable /Users/yixingzhou/.codex/tmp/arg0/codex-arg0Jky2ll/apply_patch (symlinkto/opt/homebrew/bin/codex); native Write/Edit or shell manual redirection/cat edits forbidden. If unavailable STOP with honest waiting, not fallback. Only writes own docs/test-reports/BL-WINDOWS-P1-CHECKOUT-kimi-r1-20261011/, own tests/evaluator/windows-p1-checkout-r1-*.test.ts and fixed verdict. Never product/spec/oldtests/workflow/state/features/pending_gate/memory/registry/harness/originals, no commit. Preserve complete npmci stdout/stderr/status, original81 and OWN rawJSON/stdout/stderr/status and verify logs/status. Every initial failed run immutable and correction legitimacy explicit; no tail-only evidence or rerun-to-green. DELIVERY: work within fixed1800s, prefer small single-purpose probes and compact tests. After initial actual evidence exists, write schema-valid honest PARTIAL verdict/report promptly (aim before900s), then complete own checks and finalize truthfully by1500s. Preserve any provisional report before final update. Do not spend final minutes constructing large duplicated output. If incomplete, deliver PARTIAL/FAIL with exact unperformed checks, never PASS. Do not request more time. Fixed verdict schema batch_id BL-WINDOWS-P1-CHECKOUT-SUPPORT, featureF004, result PASS/PARTIAL/FAIL or truthful waiting, evidence/steps nonempty. PASS is OFFLINE supporting evidence only; no native/provenance/Windows/full-release acceptance. Windows INITIAL/original Windows regressions/Compose/provider/encryptedbackup/custody/DBTCP/password/Agent/homepage/deploy all remain open. Coordinator alone may separately authorize one exact-source nonmain CI after a sufficient gate, you do not execute publication or CI.",
  "deliverable": {
    "artifact": "docs/test-reports/BL-WINDOWS-P1-CHECKOUT-SUPPORT-verdict.json",
    "schema": ".claude/autonomous/verdict-artifact.schema.json",
    "commit_to": null
  }
}
