{
  "task_id": "windows-p1-provenance-observation-62d419b-kimi-r0",
  "contract_version": "harness/1.1",
  "batch": "BL-WINDOWS-P1-PROVENANCE-OBSERVATION-SUPPORT",
  "role": "evaluator",
  "repo": {
    "url": "/Volumes/ORICO/project/.worktrees/tokenizer-windows-p1-provenance-observation-generator-20261011",
    "ref": "62d419b2a419b685542efaaf047b8a749839d493"
  },
  "spec": "docs/test-reports/BL-WINDOWS-P1-PROVENANCE-FAILURE-plan-20261011/proposal.json",
  "features": ["F004"],
  "l2_authorized": false,
  "deadline_s": 1800,
  "contract": "Fresh independent registered Kimi-family OFFLINE supporting Evaluator section1.5 for NEW provenance-reason source62d419b2a419b685542efaaf047b8a749839d493, parent10470c1b6064c83bd0a6712106e3009fe355e7f3, runtime baseline712cf210b089dc71f3a6e6ed2e19e1de7fee57da. NOT source712 retry/supplement or Compose attempt; no previous evaluator tests/results/conclusions reused. Read actual harness/schema/Planner proposal/critic/code yourself; original reports untrusted. Exact sole CLI docs/test-reports/windows-p1-stages-20261010/p1-stages.mjs sha411c9e10fe35bfe231d0c5daf0b01ead77f18464688d67a910c103e433d760b1,77285B. Proposal f6b28719bc9cfc77aa8b80bba98d9de4791265d3a3cd0246eff3e7ab338c5f92 S1-S6 only. NEW independent PREPARE_P11_REASON_V1_84: originalgeneric51+originalP11line29+one fixedV00-V17LF4=84 only exactprepareP11 terminal failure. NOT old80 compliant; otherphase<=80/success/nonprepare/import/guard/probe zero new output/statefilesfieldsuploads,stdout0,originalexit1. Independently prove whole CLI712 BYTE EXACT restoration removing only finite slots/reversing equivalent branches/localresult split; no whitespace stripping proof. Tree/raw/modes against712 onlyoneCLI+23declared plan/pre-scope report additions; original81 path tests/diagnostics/windows-p1-stages.test.ts exactsha7718f1e6553f1f9bccca0520571727f2a712493ce789bb8a3f0898a75e289132 unchanged; allbindings/mdHash/bindingHash/spec/workflow/old57archive/teninputs/fivecheckoutenv/11sourcefiles/16uploads/nativeAPI/E0B001/workerEOFcleanupatomiccapsbudgetselectionT0T3 unchanged. All original calls/order/arguments/propertyreads/compoundshortcircuit/return/schemafalse/caughtclone-null retained, schema call once, stringify+parse once only on true; unchangedP11assert/bothsourceFiles passes. Every S2/S3 observerwrite activeEXACTprepare&&phaseP11, nameprovenance only forrebuild; schemafalseV02/caughtschemaV03/caughtcloneV04 survive!v, P12writeJson/rebuild never mutates observer despite latch, V17 remains P11-anomalyunknown only. No added validation/source/schema/env getter reads or error property inspection. Run original81 + verify independently after fresh deps. Own compact additive ACTUAL-source-slice fullystubbed test-local VM/static/pure mocks authorized: pinned declarations/rebuild/validateProvenance/prepare/terminaldispatch slices, not replacement logger; no realfs/child/OS/worker/kill/native effects. Exercise all18fixedcodes distinguishing false vs caught schema/clone vs escaping validator vs unknown/true anomaly, null/false/true semantics/call count-order-shortcircuit/propertyreads, two source passes, oldP00-P12 output/genericexit, invalid/unassignedfixedV00, maxone reason/84-not80, successreset/silence, nonP11/P12provenancerebuild no observerchanges/emission, othermode/import/guard/probe silence. Privacy: throwing value getters/toJSON/thrownprimitive/object/Error canaries never additionally read/serialized/inspected beyond original validator/clone behavior; original reads preserved not suppressed/duplicated. Negative string controls reject reordered/missing/afteroperation/falseoverwritelatches/catchsemantics changed/addedorrepeatedcalls/shortcircuit/arguments/removedreadpass/schema-env-hash-guardlimits-widening/old80claim/over84/CRLF/duplicate/dynamic/nonmember/rawenvpatherrorhashcontent/stdout/success/wrongmode/removedreset. Mock/static support is not Windows/native feasibility. No actualCLI prepare/run/probe/seal/verifyupload or olddiagnostic/realVMnative/OSPID/kill; normalpuremodule imports after owndeps allowed, guardqueryimport forbidden. Before imports/tests set PATH=/Users/yixingzhou/.nvm/versions/node/v22.22.0/bin:/usr/sbin:/sbin:/usr/bin:/bin; owned HOME=USERPROFILE=/Volumes/ORICO/project/.wp1provoe-r0-20261011 with TMPDIR/npmcache beneath. ONE freshownnpmci, no borroweddeps/caches/node_modules/realhome/queues/systemtmp/manualsymlinks/globalinstall/auditfix/manualextra install. Normalnpm-created own internal vendor/braces/.binlinks only realpath ownWT with lock/vendorbyteidentity. Publicregistry.npmjs.org and unchanged locked package-owned Prisma/bettersqlite lifecycle endpoints only; SWC package-owned wasmregistry fallback allowed but MUST explicitly read/archive ALL ownednpmcache/_logs, capturedcorepackage/postinstall/wasmpackage(ifexists)/installedlockversion/lockabsence even defaultstdout hides fallback;7highopen, no all-lock-only/no-fallback/nativeinstalled/securityclaim from exit0. Ifinstallfails retain honestPARTIAL no installretry. Model service allowed, no authenticatedGH/Actions/push/deploy/Secretvalues/SSH/Docker/DB/installers/keycredentialreads. ALL MANUAL FILES INCLUDING ANALYSTS MUST use Bash /Users/yixingzhou/.codex/tmp/arg0/codex-arg0Jky2ll/apply_patch with ABSOLUTE File paths to ownWT. No NativeWrite/Edit/CATredirection/manualshellscript/HOMEprobe; ifapplypatchunavailableSTOP. Only authored own docs/test-reports/BL-WINDOWS-P1-PROVENANCE-OBSERVATION-kimi-r0-20261011/, tests/evaluator/windows-p1-provenance-observation-r0-*.test.ts and fixednewverdict. Generated fullrawcaptures allowed. No source/spec/originaltests/workflow/state/features/pendinggate/memory/registry/harness/otheroriginal changes or commitpush. Preserve full initial script/test/typefailures stdoutstderrstatus/rawJSON/debug separately; read actual TS env/types first, no NODE_ENV trap. Do not silently repair first falsechecks; own test-only corrections justified, no behavioral rerun-to-green or acceptance relaxation. Aim compact own tests, honest actual provisional PARTIAL by900s saved separately and retained, truthfullyfinalby1500s, fixedhard1800 noextension. Fixed schema batch/F004 nonempty evidence/steps. PASS OFFLINE supporting only, notformalF004F005/native/fullrelease/dependencysecurity; originalpreparecauseunknown until separatelyapproved singleNEWsourceCI. You nevergrantpublication/runCI. No automaticredispatch, atmostone separatelyadjudicated ifnecessary, nofamilyfallback/capextension/Compose3rd/source712rerun. ComposeHARDSTOP/keydeferral/nobackuprestorebaselinepassword/release_readyfalse remain.",
  "deliverable": {
    "artifact": "docs/test-reports/BL-WINDOWS-P1-PROVENANCE-OBSERVATION-SUPPORT-verdict.json",
    "schema": ".claude/autonomous/verdict-artifact.schema.json",
    "commit_to": null
  }
}
