{
  "task_id": "compose-shape-5c5c283-kimi-support-r2-once",
  "contract_version": "harness/1.1",
  "batch": "BL-COMPOSE-VERSION-SHAPE-SUPPORT",
  "role": "evaluator",
  "repo": {"url":"/Volumes/ORICO/project/.worktrees/tokenizer-compose-shape-repair-20261009","ref":"5c5c283b08d225b42d8db19abcbe5d3c1f562ac4"},
  "spec": "docs/specs/BL-COMPOSE-VERSION-SHAPE-20261009.md",
  "features": ["F003"],
  "l2_authorized": false,
  "deadline_s": 1800,
  "contract": "Fresh independent Kimi-family supporting Evaluator under harness1.5, not formal F005/native/release. Read exact source ref and locked spec/role/rules from disk; reports are claims, not acceptance. Evaluate all spec criteria without modifying source/spec/oldtests/state/memory/dependencies/old evidence. Derive OWN compact data-driven synthetic controls beyond43+32+47 existing tests for every prefix/core/tail class and flag (CR/LF/space/tab/escape/nonASCII), byte/locale/trailing-newline semantics, null shape/failure/overflow/hung capture, unchanged argv/caps/refusal and no new/later/mutation queries; exercise real jq validator exact keys/types/enums/relations/bounds/canaries and old allowlists. Mechanically verify frozen boundaries via git diff/blobs, not fragile escaping-heavy whole-file fixture reconstruction. Existing32 allows only locked spec changes; original43 and old negative array/count/caps frozen. Do not write a giant duplicate suite: compact tables and direct git evidence suffice, but do not skip criteria or soften any failure. Run fresh npmci,122 controls, verify/lint and OWN controls, then write ORIGINAL report and schema verdict with actual evidence before deadline. Node22.22.0 exists /Users/yixingzhou/.nvm/versions/node/v22.22.0/bin; PATH needs /usr/sbin:/sbin. No Node download. Synthetic HOME/USERPROFILE/TMPDIR/npm cache ONLY /Volumes/ORICO/project/.cske-r2-20261009 on external disk; fresh own dependency tree, never borrowed symlink; Vitest --no-cache. Do not use system/tmp/cache or user queues. No prod/SSH/realDocker/networkDB/credentials/Secrets/env changes/installers/push/deploy. Public dependency/model integration services permitted. New files only docs/test-reports/BL-COMPOSE-VERSION-SHAPE-kimi-r2-support-20261009/ and own tests/evaluator/compose-shape-r2-* plus fixed verdict. No commit. Retain initial failures and corrections as distinct complete raw logs, no retry-to-green. Parent batch remains building/release_ready=false. Report bounded local acceptance only; actual host format/predecessor, Windows, backup/recovery/age custody, PostgreSQL TCP password/protected Secret, Agent/homepage and final release gates open. Honest PARTIAL/FAIL/waiting if incomplete; no release claim. This is the one allowed re-dispatch after canceled task, unchanged source/criteria/1800s; if unable finish, deliver honest partial verdict, not invented evidence.",
  "deliverable": {"artifact":"docs/test-reports/BL-COMPOSE-VERSION-SHAPE-SUPPORT-verdict.json","schema":".claude/autonomous/verdict-artifact.schema.json","commit_to":null}
}
